{
  "applicable_os": [
    "iosxe"
  ],
  "category": "security",
  "confidence": "medium",
  "prerequisites": [
    "Physical console access to the device (serial or USB console cable)",
    "Ability to power-cycle the device (for ROMMON-based recovery)",
    "Know the device platform and OS to select the correct procedure",
    "Authorization to perform password recovery (security policy may require approval)"
  ],
  "procedure_id": "password-recovery-iosxe",
  "procedure_name": "Password Recovery and AAA Lockout Recovery (iosxe)",
  "purpose": "Recover access to a device when admin credentials are lost or AAA server is unreachable [iosxe — method: ROMMON confreg 0x2142 (bypass startup-config); platforms: Catalyst 9000, Catalyst 8000, ASR 1000, ISR 4000]",
  "risk_level": "medium",
  "rollback": [
    {
      "action": "No rollback needed — password reset is additive",
      "commands": [],
      "step_id": "rollback-1"
    },
    {
      "action": "If config was accidentally overwritten: restore from backup server",
      "commands": [],
      "step_id": "rollback-2"
    }
  ],
  "schema_version": "1.0.0",
  "sources": [
    {
      "id": "cisco:procedures/password-recovery.json",
      "title": "cisco knowledge base — procedures/password-recovery.json",
      "type": "documentation"
    }
  ],
  "steps": [
    {
      "action": "Connect console cable and power-cycle the device",
      "commands": [],
      "notes": "You must be on the console port. Terminal settings: 9600/8/N/1.",
      "step": 1,
      "step_id": "step-1"
    },
    {
      "action": "Break into ROMMON",
      "commands": [],
      "notes": "Send break signal during boot (Ctrl+Break on Windows, Ctrl+A then 'send break' on macOS/screen). Timing: within first 60 seconds of boot.",
      "step": 2,
      "step_id": "step-2"
    },
    {
      "action": "Change config register to skip startup-config",
      "commands": [
        {
          "command": "confreg 0x2142",
          "os": "iosxe",
          "version_range": {
            "max": "*",
            "min": "*"
          }
        }
      ],
      "notes": "0x2142 tells the device to ignore startup-config on boot. The config is NOT deleted, just skipped.",
      "step": 3,
      "step_id": "step-3"
    },
    {
      "action": "Boot the device",
      "commands": [
        {
          "command": "boot",
          "os": "iosxe",
          "version_range": {
            "max": "*",
            "min": "*"
          }
        }
      ],
      "notes": "Device boots with no configuration (factory default). All interfaces will be shutdown.",
      "step": 4,
      "step_id": "step-4"
    },
    {
      "action": "Load the saved startup-config",
      "commands": [
        {
          "command": "copy startup-config running-config",
          "os": "iosxe",
          "version_range": {
            "max": "*",
            "min": "*"
          }
        }
      ],
      "notes": "CRITICAL: Do NOT use 'copy running-config startup-config' — that would overwrite your saved config with the blank one. Load the saved config INTO running.",
      "step": 5,
      "step_id": "step-5"
    },
    {
      "action": "Change the password",
      "commands": [
        {
          "command": "configure terminal\nenable secret <new_password>\nusername admin privilege 15 secret <new_password>",
          "os": "iosxe",
          "version_range": {
            "max": "*",
            "min": "*"
          }
        }
      ],
      "notes": "Reset enable password and any local user passwords.",
      "step": 6,
      "step_id": "step-6"
    },
    {
      "action": "Reset config register to normal",
      "commands": [
        {
          "command": "config-register 0x2102",
          "os": "iosxe",
          "version_range": {
            "max": "*",
            "min": "*"
          }
        }
      ],
      "notes": "CRITICAL: If you forget this, the device will skip startup-config on EVERY reboot — effectively losing config on every reload.",
      "step": 7,
      "step_id": "step-7"
    },
    {
      "action": "Save and verify",
      "commands": [
        {
          "command": "copy running-config startup-config",
          "os": "iosxe",
          "version_range": {
            "max": "*",
            "min": "*"
          }
        }
      ],
      "notes": "Save the new password and restored config. Verify: show version | include Configuration register (should show 0x2102).",
      "step": 8,
      "step_id": "step-8"
    },
    {
      "action": "Verify the procedure completed successfully",
      "commands": [],
      "step": 9,
      "step_id": "verify",
      "verification": [
        {
          "command": "show version | include Configuration register",
          "confirms_if": "Config register is back to normal — device will boot with config on next reload",
          "look_for": "Configuration register is 0x2102",
          "os": "iosxe",
          "version_range": {
            "max": "*",
            "min": "*"
          }
        },
        {
          "command": "show running-config | include enable secret",
          "confirms_if": "Enable password has been changed",
          "look_for": "enable secret set to new value",
          "os": "iosxe",
          "version_range": {
            "max": "*",
            "min": "*"
          }
        },
        {
          "command": "show startup-config | include enable secret",
          "confirms_if": "New password is saved to startup-config",
          "look_for": "Same as running-config",
          "os": "iosxe",
          "version_range": {
            "max": "*",
            "min": "*"
          }
        }
      ]
    }
  ],
  "warnings": [
    "Password recovery requires PHYSICAL console access — there is no remote recovery method",
    "Some organizations disable password recovery for security (NX-OS: 'system no password-recovery', IOS-XE: 'no service password-recovery')",
    "If password recovery is disabled, the ONLY option is to erase the configuration and start fresh",
    "On IOS-XE: confreg 0x2142 skips startup-config on boot — do NOT forget to set it back to 0x2102",
    "Document new credentials securely after recovery",
    "If 'no service password-recovery' is configured, breaking into ROMMON triggers a full config erase",
    "On stacked switches: password recovery on the Active switch recovers the entire stack",
    "Catalyst 9000 with secure boot: ROMMON access may require additional authentication",
    "NEVER forget step 7 (config-register 0x2102) — this is the most common mistake"
  ]
}
