{
  "applicable_os": [
    "nxos"
  ],
  "category": "security",
  "confidence": "medium",
  "prerequisites": [
    "Physical console access to the device (serial or USB console cable)",
    "Ability to power-cycle the device (for ROMMON-based recovery)",
    "Know the device platform and OS to select the correct procedure",
    "Authorization to perform password recovery (security policy may require approval)"
  ],
  "procedure_id": "password-recovery-nxos",
  "procedure_name": "Password Recovery and AAA Lockout Recovery (nxos)",
  "purpose": "Recover access to a device when admin credentials are lost or AAA server is unreachable [nxos — method: Admin password reset via loader/POAP; platforms: Nexus 9000, Nexus 3000]",
  "risk_level": "medium",
  "rollback": [
    {
      "action": "No rollback needed — password reset is additive",
      "commands": [],
      "step_id": "rollback-1"
    },
    {
      "action": "If config was erased: restore from backup with 'copy scp://server/backup.cfg running-config'",
      "commands": [],
      "step_id": "rollback-2"
    }
  ],
  "schema_version": "1.0.0",
  "sources": [
    {
      "id": "cisco:procedures/password-recovery.json",
      "title": "cisco knowledge base — procedures/password-recovery.json",
      "type": "documentation"
    }
  ],
  "steps": [
    {
      "action": "Connect console cable and power-cycle the device",
      "commands": [],
      "notes": "You must be on the console port. SSH/telnet will not work if you're locked out.",
      "step": 1,
      "step_id": "step-1"
    },
    {
      "action": "Break into the loader prompt",
      "commands": [],
      "notes": "Press Ctrl+C or Ctrl+] during boot when you see 'Press Ctrl-C or Ctrl-] to enter the loader prompt'. Timing is critical — watch for the prompt.",
      "step": 2,
      "step_id": "step-2"
    },
    {
      "action": "Boot with admin password reset",
      "commands": [
        {
          "command": "cmdline recoverpw",
          "os": "nxos",
          "version_range": {
            "max": "*",
            "min": "*"
          }
        }
      ],
      "notes": "NX-OS 9.2+ on Nexus 9000. This boots the system with admin password reset to default. On older NX-OS, use 'boot nxos bootflash:<image> admin-password' instead.",
      "step": 3,
      "step_id": "step-3"
    },
    {
      "action": "Boot the image",
      "commands": [
        {
          "command": "boot nxos bootflash:<image>",
          "os": "nxos",
          "version_range": {
            "max": "*",
            "min": "*"
          }
        }
      ],
      "notes": "After setting recoverpw, boot the image normally. The admin password will be reset.",
      "step": 4,
      "step_id": "step-4"
    },
    {
      "action": "Log in with default credentials and reset password",
      "commands": [
        {
          "command": "configure terminal\nusername admin password <new_password> role network-admin",
          "os": "nxos",
          "version_range": {
            "max": "*",
            "min": "*"
          }
        }
      ],
      "notes": "Log in as admin with no password (or default password depending on NX-OS version). Immediately set a new admin password.",
      "step": 5,
      "step_id": "step-5"
    },
    {
      "action": "Save configuration",
      "commands": [
        {
          "command": "copy running-config startup-config",
          "os": "nxos",
          "version_range": {
            "max": "*",
            "min": "*"
          }
        }
      ],
      "notes": "Save the new password to startup-config. Verify with 'show running-config | include username admin'.",
      "step": 6,
      "step_id": "step-6"
    },
    {
      "action": "Verify the procedure completed successfully",
      "commands": [],
      "step": 7,
      "step_id": "verify",
      "verification": [
        {
          "command": "show users",
          "confirms_if": "Admin access restored",
          "look_for": "Admin user logged in via console",
          "os": "nxos",
          "version_range": {
            "max": "*",
            "min": "*"
          }
        },
        {
          "command": "show running-config | include username admin",
          "confirms_if": "Admin account is configured correctly",
          "look_for": "username admin with role network-admin",
          "os": "nxos",
          "version_range": {
            "max": "*",
            "min": "*"
          }
        }
      ]
    }
  ],
  "warnings": [
    "Password recovery requires PHYSICAL console access — there is no remote recovery method",
    "Some organizations disable password recovery for security (NX-OS: 'system no password-recovery', IOS-XE: 'no service password-recovery')",
    "If password recovery is disabled, the ONLY option is to erase the configuration and start fresh",
    "On IOS-XE: confreg 0x2142 skips startup-config on boot — do NOT forget to set it back to 0x2102",
    "Document new credentials securely after recovery",
    "If 'system no password-recovery' is configured, the only option is to wipe the config entirely",
    "Nexus 7000 uses a different procedure — boot to kickstart image, then use 'admin-password' option",
    "POAP (PowerOn Auto Provisioning) may trigger if config is erased — disable DHCP on mgmt before recovery"
  ]
}
